{
  "api_route_family": "v1",
  "evidence_method": "Microsoft Foundry deployment Details page showed the Azure OpenAI-compatible v1 route family",
  "observed_at": "2026-08-11 10:51:58 HKT (+0800)",
  "explicitly_excluded": [
    "endpoint_url_or_path",
    "key",
    "subscription",
    "tenant",
    "email",
    "account_identifier"
  ]
}
